{
  "runId": "2026-06-07-001",
  "stageId": "coverage_review",
  "stageName": "覆盖审阅",
  "agentRole": "覆盖审阅 subagent",
  "status": "PASS",
  "decision": "APPROVE_PARTIAL_COVERAGE_FOR_SCRIPT_INTEGRATION",
  "summary": "“全量回归活动后管”应纳入自动化覆盖并继续推进到脚本整合。现有覆盖虽为 PARTIAL，但主干编排和后管脚本已具备复用基础，当前缺口属于可在整合前补稳的明确问题。",
  "inputs": [
    "history/2026-06-07-001/00-任务说明.md",
    "history/2026-06-07-001/run-state.json",
    "history/2026-06-07-001/01-链路分析报告.md",
    "history/2026-06-07-001/01-链路分析报告.json",
    "orchestrations/automation-review-pipeline/schemas/stage-report.schema.json",
    "orchestrations/automation-review-pipeline/prompts/02-覆盖审阅.md"
  ],
  "findings": [
    "现有覆盖结论为 PARTIAL，而不是 NONE；说明该需求已具备可复用自动化基础，不需要从零设计。",
    "仓库内已有 lottery 后管选择集、13 条通用活动后管脚本，以及“后管回归”聚合入口，可直接作为 script_integration 的子入口。",
    "2026-06-07 已有“直接后管回归”和“按 subagent 拆分执行”两类真实执行记录，证明该需求有持续自动化价值。",
    "当前缺口集中在 lottery 任务阶段稳定性和 AGENT 环境前置检查，属于可修复的固定缺口，不构成拒绝自动化覆盖的理由。"
  ],
  "evidence": [
    "history/2026-06-07-001/01-链路分析报告.md：结论为 PARTIAL，并明确推荐 coverage_review 按“值得继续推进”处理。",
    "history/2026-06-07-001/01-链路分析报告.json：entrypoints 已列出 lottery 后管入口、13 条通用活动回归脚本和现有聚合入口。",
    "docs/session-handoff.md：2026-06-07 已记录活动后管全量回归真实执行，以及按 subagent 拆分的 lottery + universal 执行。",
    "orchestrations/automation-review-pipeline/prompts/02-覆盖审阅.md：即使 existingCoverage=PARTIAL，只要值得纳入自动化覆盖，也可以 APPROVE 并进入脚本整合。"
  ],
  "risks": [
    "若不先修复 lottery 任务阶段的 7076 基线和 reward-mode 回查问题，后续整合后仍可能重复出现 TM 系列失败。",
    "若不补 AGENT 在线活动前置检查，通用后管回归仍可能因环境中已有在线活动而失败。",
    "若跳过 script_integration，直接把现有总入口当作最终方案，会绕开本次 automation_review_pipeline 的正式整合要求。"
  ],
  "nextAction": "批准进入 script_integration，先补 lottery 任务阶段稳定性与 AGENT 在线活动前置检查，再整合 lottery 后管入口与 13 条通用活动后管脚本。",
  "relatedCommands": [
    "node tools/first-run-check.mjs --skill admin",
    "node orchestrations/lottery-regression/scripts/run-full-headless.mjs --selection '后管回归' --recharge-amount 1000 --wait-for-start-ms 60000",
    "node orchestrations/full-regression/scripts/run-full-regression.mjs --selection '后管回归' --confirm-run"
  ],
  "relatedFiles": [
    "history/2026-06-07-001/00-任务说明.md",
    "history/2026-06-07-001/run-state.json",
    "history/2026-06-07-001/01-链路分析报告.md",
    "history/2026-06-07-001/01-链路分析报告.json",
    "docs/session-handoff.md",
    "orchestrations/automation-review-pipeline/prompts/02-覆盖审阅.md",
    "orchestrations/lottery-regression/scripts/run-full-headless.mjs",
    "orchestrations/full-regression/scripts/run-full-regression.mjs",
    "skills/weex-admin-ops/scripts/lottery-admin-main-regression.mjs",
    "skills/weex-admin-ops/scripts/regression-agent-universal-from-scratch.mjs"
  ],
  "timestamp": "2026-06-07T18:14:07Z",
  "existingCoverage": "PARTIAL",
  "coverageDecision": "APPROVE"
}